{
  "schema_version": "1.0.0",
  "record_type": "decision",
  "id": "gls:decision:c1217342-d5cb-4015-bf1b-b04034d09f8a",
  "decision_key": "ADR-0003",
  "title": "Model Frontier Questions as Works",
  "status": "accepted",
  "decided_at": "2026-08-01T22:26:12+07:00",
  "immutable": true,
  "context": "Standing God Questions need durable identity, changing answers, evidence ownership, refresh triggers, and safe public boundaries without creating a second research registry.",
  "decision": "A Frontier Question is a research-question Work, an accepted answer is a Release, and the latest whole-Library Snapshot selects the current public portfolio.",
  "rationale": [
    "Questions persist while answers and evidence change.",
    "Existing Work, Release, and Snapshot semantics already express that lineage.",
    "Foundry, SISO Knowledge, and Evidence Engines retain independent discovery, corpus, and transformation ownership."
  ],
  "alternatives": [
    { "option": "Create a separate God Questions database and website", "disposition": "rejected", "reason": "It would duplicate identity, release, and selection contracts already present in the Library." },
    { "option": "Store questions as unversioned documents", "disposition": "rejected", "reason": "Documents alone cannot preserve selected-answer lineage or machine-resolvable refresh contracts." },
    { "option": "Extend Work with a research contract", "disposition": "chosen", "reason": "It adds question-specific metadata without inventing a parallel ontology." }
  ],
  "consequences": {
    "positive": ["Questions have stable IDs and public URLs.", "Answer history can be immutable and independently evidenced."],
    "negative": ["Question metadata releases increase Work and Release counts even before a public answer artifact exists."],
    "follow_ups": ["Label metadata seeds distinctly from accepted answer Releases and preserve private or rights-unclear evidence outside the Library."]
  },
  "scope": {
    "work_ids": ["gls:work:2ac84615-3f9d-4040-95d6-9d9f39e4dc84", "gls:work:e38b054f-b926-4410-b84d-4fd3249fd4f4", "gls:work:85964f1c-2efe-48b0-8f71-dc32bb668c0c", "gls:work:7782f923-d44e-4a47-8ce6-134e31816673", "gls:work:2144e900-4886-461e-92f1-49571f2e9f74", "gls:work:3b4c4fa6-31f2-4cfc-9542-00f32e200621"],
    "snapshot_ids": ["gls:snapshot:73ee0c53-7e65-4c1c-9fe8-c990607ebf89"]
  },
  "evidence": [{ "kind": "documentation", "reference": "docs/research-question-model.html", "observed_at": "2026-08-01", "summary": "The Frontier Questions model assigns durable question identity to Works and versioned answers to Releases." }]
}
